{
  "id": "anemia",
  "title": "Pediatric Anemia",
  "schemaVersion": 1,
  "status": "integrity-recorded",
  "knowledgeBaseVersion": "0.1.0-2026-07-15",
  "evidenceReviewedThrough": "2026-07-15",
  "engineLabel": "Pediatric Anemia Deterministic CDSS",
  "supportedAgeMonths": {
    "min": 6,
    "max": 216
  },
  "clinicalContentHash": "sha256:7399acc68fca47cd5e6885de94426a17f5976aad9273fdc183235244075f272e",
  "governanceHash": "sha256:31db1196ca3231a43b12565e1512a4efd182d60e4db2f524f6cef6391728eff9",
  "approvedBy": [],
  "validationRunId": "local-dev:unattested",
  "supersedes": null,
  "releasedAt": null
}
